title,slug,description,content,categoryNames,supplierName,images
Profound multi-tasking capability,profound-multi-tasking-capability,Knowledge thank step appear happy before despite raise stay Mrs produce bill alone boy.,Night no simple race quickly almost. Cultural less rule make. Piece very light throughout method behavior. Argue sign drug ten important know.,Coffee & Espresso,Health & Beauty Innovations,"https://dummyimage.com/640x480,https://www.lorempixel.com/640/480,https://www.lorempixel.com/640/480"
Self-enabling intermediate Graphical User Interface,self-enabling-intermediate-graphical-user-interface,Figure every notice which his where light mind oil sit admit measure finally.,Level fast same party after stand subject marriage. A thus program sell man. Reason buy no half trade. Behind site my heart economic actually power.,Kids & Toys,Furniture & Decor Mart,https://placekitten.com/640/480
Team-oriented background instruction set,team-oriented-background-instruction-set,First accept agree end born song partner.,Boy fly skin natural maintain thing. Character night event. Sport industry election action smile every. Would cold painting send early girl.,Sports & Outdoors,Furniture & Decor Mart,"https://placeimg.com/640/480/any,https://placeimg.com/640/480/any,https://www.lorempixel.com/640/480"
Compatible tertiary Local Area Network,compatible-tertiary-local-area-network,Care smile require good open sense focus think night certain smile time attorney.,These last middle career professor customer enter. Teach education skin food including challenge including. Staff point ball animal easy story. Out sit direction just true person wonder. Summer tree world result.,Oral Care,Book Nook Publishers,"https://www.lorempixel.com/640/480,https://placeimg.com/640/480/any,https://placekitten.com/640/480"
Open-source logistical middleware,open-source-logistical-middleware,Owner soon discuss glass maintain modern simple maybe growth.,Hit human western successful want serve. Protect yet teach mind final choice guy. Medical first ready at mind. Contain responsibility Republican bank imagine.,Sports & Outdoors,Outdoor Gear Co.,"https://placeimg.com/640/480/any,https://placeimg.com/640/480/any"
Networked leadingedge parallelism,networked-leadingedge-parallelism,Soldier base everything marriage available report hundred almost old industry most like.,Mr reduce will production loss test product team. Join black some movie quickly people you. Wall simple ten. Wish about bed guess look exactly. Before media under to.,Skincare,Kitchen Masterpieces,https://placeimg.com/640/480/any
Programmable well-modulated matrix,programmable-well-modulated-matrix,Simple for difficult now soon opportunity service range series position need environment discuss have goal by.,Baby indicate finally hundred. Air phone anyone into surface education. Paper series member these contain customer.,Kids & Toys,Sports Gear Pro,"https://dummyimage.com/640x480,https://placekitten.com/640/480"
Assimilated methodical firmware,assimilated-methodical-firmware,Value around half guy reason item painting should common argue cup language maybe cultural project.,Feeling none compare. How red research couple ground together. Produce agent rule within.,Televisions,Health & Beauty Innovations,"https://placekitten.com/640/480,https://placekitten.com/640/480"
User-friendly multimedia complexity,user-friendly-multimedia-complexity,Read summer out identify blood manager evidence.,Gun employee weight beautiful real effect. Career say what lose. Generation change produce back.,Smart Home,Tech Innovations Inc.,"https://www.lorempixel.com/640/480,https://placekitten.com/640/480,https://www.lorempixel.com/640/480"
Implemented even-keeled system engine,implemented-even-keeled-system-engine,Suffer end structure gun draw true red health central.,Build look same available structure. Candidate doctor back.,Shelving,Health & Beauty Innovations,"https://www.lorempixel.com/640/480,https://placekitten.com/640/480"
Assimilated systemic architecture,assimilated-systemic-architecture,Sign play answer argue woman whole front.,Capital easy edge. Week number fire yeah. Including meet anything brother determine large audience. Decision nice more special bank body ago. Others every where positive try only weight other.,Skincare,Outdoor Gear Co.,https://placekitten.com/640/480
Universal asynchronous knowledge user,universal-asynchronous-knowledge-user,Expert relate require son late tonight song prepare.,Rule trip scientist specific common. Out send know upon accept rest approach need.,Cameras,EcoWear Apparel,https://placekitten.com/640/480
Centralized high-level intranet,centralized-high-level-intranet,Teacher chance teacher only any series determine draw center particular picture new about few watch information.,Amount rest gun per. Challenge beat guy consumer. Price walk media down standard customer participant. Wait ball or day entire she agree. Let media movement although course boy.,Health & Beauty,Tech Innovations Inc.,"https://www.lorempixel.com/640/480,https://placekitten.com/640/480"
Enterprise-wide multi-state productivity,enterprise-wide-multi-state-productivity,Store side soon house who enter democratic morning machine who newspaper business down floor.,Side strategy range. Activity time outside main figure book.,Furniture & Decor,Kitchen Masterpieces,"https://www.lorempixel.com/640/480,https://dummyimage.com/640x480"
Programmable systematic definition,programmable-systematic-definition,Market tell section head agree admit behind responsibility down together available contain sea.,Quality several still age allow garden child stock. Of hold customer believe tax. Represent produce crime both let. Break rate above model.,Home & Living,Outdoor Gear Co.,"https://www.lorempixel.com/640/480,https://placekitten.com/640/480,https://dummyimage.com/640x480"
Intuitive 3rdgeneration functionalities,intuitive-3rdgeneration-functionalities,Thought phone take subject cultural mind manager force send time.,Her heart soon age them. May section home own there way fly. Nor upon may couple decade. Light media on with cover minute different.,Baking & Mixing,Furniture & Decor Mart,https://placekitten.com/640/480
Triple-buffered dedicated leverage,triple-buffered-dedicated-leverage,Mother head cut hospital glass personal result look could do.,Into list check place experience. Garden pressure positive high.,Cleaning,Furniture & Decor Mart,"https://placeimg.com/640/480/any,https://placekitten.com/640/480"
Inverse 24hour alliance,inverse-24hour-alliance,Act let guy opportunity attorney treat own hold mission must.,Action art energy anyone early. Best put college science run a. Capital home serious low cover. Though ball environmental radio.,Cookware,Furniture & Decor Mart,"https://dummyimage.com/640x480,https://www.lorempixel.com/640/480,https://dummyimage.com/640x480"
Multi-tiered incremental knowledge user,multi-tiered-incremental-knowledge-user,Or pressure within ever piece such would last arrive run.,Someone population property dark about here. Subject remain alone sister participant laugh better. Art responsibility management serve.,Smart Home,Bac Mobile,https://placekitten.com/640/480
Re-engineered background artificial intelligence,re-engineered-background-artificial-intelligence,Suddenly require significant public responsibility during yard idea pay.,Fill exist treatment enough real student. Often few wear happy including. Focus group author each tonight. Offer truth life seem.,Wearable Tech,Sports Gear Pro,"https://www.lorempixel.com/640/480,https://placeimg.com/640/480/any"
Front-line multi-tasking definition,front-line-multi-tasking-definition,Likely father career behind much week first baby business trouble.,Just artist ago test. Join turn material see mean. Prevent leader number history. Now guy political hear them high garden local.,Wearable Tech,Bac Mobile,"https://www.lorempixel.com/640/480,https://www.lorempixel.com/640/480"
Future-proofed tertiary attitude,future-proofed-tertiary-attitude,Nor situation history behind show event listen finish whose southern feeling position product.,We out individual necessary energy economic call. Issue baby environmental cup once big. Once since exactly get may. Range it case evening family sense. Half single hard TV outside step share.,Camping Gear,EcoWear Apparel,https://placeimg.com/640/480/any
Secured coherent knowledgebase,secured-coherent-knowledgebase,Term range already for child else side rock vote behavior body occur while Congress.,Style get performance establish interesting poor data both. Them something discuss pull. Sell behind around someone law full. Travel recent guy describe.,Televisions,Tech Innovations Inc.,"https://placeimg.com/640/480/any,https://dummyimage.com/640x480"
Expanded static functionalities,expanded-static-functionalities,Us real develop raise summer this white.,Personal report raise few result measure. Now customer bit. Others it energy quality painting scene hard.,Baking & Mixing,Bac Mobile,"https://www.lorempixel.com/640/480,https://dummyimage.com/640x480,https://placekitten.com/640/480"
Reverse-engineered context-sensitive migration,reverse-engineered-context-sensitive-migration,Produce fight reason yet arm final film indicate myself everyone phone away region treat.,Great hot exactly network effect general. How first heart today month. Wide wide ago evening continue have. Maintain capital per final hot.,Cleaning,Book Nook Publishers,"https://placekitten.com/640/480,https://www.lorempixel.com/640/480,https://dummyimage.com/640x480"
Switchable composite Graphical User Interface,switchable-composite-graphical-user-interface,Late fish ask summer board who race now point successful tell company hair book.,Dinner pick yard strategy reach ahead. Hope would back according.,Smart Home,Book Nook Publishers,"https://www.lorempixel.com/640/480,https://placeimg.com/640/480/any"
Phased needs-based help-desk,phased-needs-based-help-desk,First even difference carry conference debate director leave everybody ok.,Model politics student executive society wall. Song room live common talk.,Educational Toys,KidZone Essentials,https://placeimg.com/640/480/any
Advanced attitude-oriented policy,advanced-attitude-oriented-policy,Report the every off hope hour professor growth always draw man movement politics like director participant.,Food candidate second serious. Ahead name within issue financial. Low and whose realize network.,Fashion,Health & Beauty Innovations,https://dummyimage.com/640x480
Phased maximized access,phased-maximized-access,Different skin number while actually information factor.,Avoid event per people before. Image exist senior dog dark value establish. Development recent relationship scientist task expect modern. Evidence list environmental sing site act process. System image nature figure series nature.,Fitness & Exercise,EcoWear Apparel,https://www.lorempixel.com/640/480
Synergistic even-keeled array,synergistic-even-keeled-array,Practice southern occur recent than else body goal amount show.,Save find high. Fine concern family bill reduce relationship responsibility. Whatever animal against American charge view reach.,Cameras,Home Comforts Ltd.,"https://placekitten.com/640/480,https://placeimg.com/640/480/any"
Distributed 6thgeneration Local Area Network,distributed-6thgeneration-local-area-network,Although maintain manage white body win class and decide since seven appear.,Modern day important draw. Food act heart wife respond fact describe. On trial expect see.,Smart Phone,Outdoor Gear Co.,"https://dummyimage.com/640x480,https://dummyimage.com/640x480,https://www.lorempixel.com/640/480"
Polarized actuating matrix,polarized-actuating-matrix,Color traditional catch quite good across most building throw family job age year Republican.,Beyond bill necessary your success. Hair by everybody statement style second road. Bed dinner over. Trouble agent mean whose. Summer lawyer discover American box institution.,Fitness & Exercise,Home Comforts Ltd.,https://placeimg.com/640/480/any
Profound incremental capacity,profound-incremental-capacity,Class join painting term similar season sister production school material together bit.,Environment page benefit stock. Majority there item measure debate. Where child trial place. Me relate appear live forward foot alone.,Fashion,Sports Gear Pro,"https://www.lorempixel.com/640/480,https://placekitten.com/640/480,https://www.lorempixel.com/640/480"
Object-based web-enabled support,object-based-web-enabled-support,Owner recently nature new education explain under son than analysis choice performance daughter billion.,Final we yard risk few and. Relate network yes yeah. Enough wear environmental them strong include wind several. Prove officer later interesting citizen community.,Smart Home,Book Nook Publishers,"https://www.lorempixel.com/640/480,https://dummyimage.com/640x480,https://placeimg.com/640/480/any"
Re-contextualized well-modulated infrastructure,re-contextualized-well-modulated-infrastructure,Explain key child table away debate teach heart range rise attack teach against their knowledge million.,Walk lawyer yard pretty figure carry. Any wear past admit. Responsibility relationship environmental bad protect. Gun me chance partner industry floor.,Sports & Outdoors,Furniture & Decor Mart,"https://dummyimage.com/640x480,https://placekitten.com/640/480,https://placeimg.com/640/480/any"
Re-contextualized bi-directional secured line,re-contextualized-bi-directional-secured-line,Buy red pretty who idea walk understand decision result weight health speak church.,Role nor myself stuff question could. Event surface area girl mother. Environment good like look act morning trip real.,Fashion,Furniture & Decor Mart,"https://placekitten.com/640/480,https://dummyimage.com/640x480"
Synergistic bi-directional hierarchy,synergistic-bi-directional-hierarchy,Once tax sport million wall behind remember time none resource just whose foreign see Mrs.,Gas day north need nor me hundred. Would deal right science. Executive maybe others. Nor coach south hard take stay notice.,Televisions,Book Nook Publishers,https://placekitten.com/640/480
Decentralized upward-trending protocol,decentralized-upward-trending-protocol,Our site authority check forget partner red out forget top past.,Short person fund find serious. Mean leave exist spring toward.,Cookware,Outdoor Gear Co.,https://dummyimage.com/640x480
Reverse-engineered solution-oriented database,reverse-engineered-solution-oriented-database,Power third total prove material north cup wait tend take research politics between gas letter.,Despite clear begin society over position note indicate. Must sell wife common all economy.,Sports & Outdoors,Outdoor Gear Co.,"https://www.lorempixel.com/640/480,https://www.lorempixel.com/640/480"
Up-sized logistical analyzer,up-sized-logistical-analyzer,Matter across prepare feel TV season discuss will method site.,Hot last toward if forward well. Miss indicate firm game establish age argue.,Shorts,Furniture & Decor Mart,https://placekitten.com/640/480
Realigned upward-trending monitoring,realigned-upward-trending-monitoring,Church common safe color central perhaps go finish left.,Power girl I particular. Six if those meet.,Kids & Toys,Kitchen Masterpieces,"https://dummyimage.com/640x480,https://www.lorempixel.com/640/480,https://dummyimage.com/640x480"
Mandatory 24hour archive,mandatory-24hour-archive,Character short indeed face enjoy total operation now service lay there science late life really.,Behavior decision arrive someone quite total visit by. Anything three tough religious light probably coach. Community coach tell figure a. Far firm travel scientist western.,Fashion,Outdoor Gear Co.,"https://www.lorempixel.com/640/480,https://dummyimage.com/640x480"
Inverse didactic orchestration,inverse-didactic-orchestration,Chance its set floor give more candidate tell across explain heavy.,Heavy war worry heart save better need. Parent newspaper produce natural shake bad. Step marriage five doctor. Nor different which newspaper name month threat entire.,Footwear,Tech Innovations Inc.,https://placekitten.com/640/480
Pre-emptive radical utilization,pre-emptive-radical-utilization,Clearly story economy cover head despite black before question town.,Health would name protect his. Care party good firm talk identify. Sense job at computer model raise not officer. A similar myself foot run act again center.,Home & Living,Book Nook Publishers,https://placekitten.com/640/480
Digitized dynamic productivity,digitized-dynamic-productivity,Far company recently move perform hit middle Republican.,Box attack mind easy investment safe. Offer age agency high leave number.,Cleaning,Home Comforts Ltd.,https://dummyimage.com/640x480
Public-key analyzing encoding,public-key-analyzing-encoding,Event listen lawyer person wear table tonight mission hour section energy yeah simply.,Detail when positive sit. Visit wrong toward indeed.,Bedding,Furniture & Decor Mart,"https://placeimg.com/640/480/any,https://dummyimage.com/640x480"
Persistent analyzing access,persistent-analyzing-access,Mention sure mention medical head once my activity politics who difference test method within.,Less with let plant. Article nature car. Another information design over consider. Catch poor public where often.,Coffee & Espresso,Outdoor Gear Co.,https://dummyimage.com/640x480
Customer-focused fault-tolerant policy,customer-focused-fault-tolerant-policy,How all play white home detail which large who treatment like.,Less occur sea still current century. Yourself down arrive public test even attention maybe. Population sure water. Main around attorney decade.,Sports & Outdoors,Outdoor Gear Co.,"https://dummyimage.com/640x480,https://placekitten.com/640/480"
Robust content-based approach,robust-content-based-approach,Partner year age notice computer appear two fund race since increase career.,Same suggest gas. Son join probably. Skin green reason throw.,Shorts,KidZone Essentials,https://dummyimage.com/640x480
Seamless radical conglomeration,seamless-radical-conglomeration,Idea prepare similar hour control help onto similar behind kitchen food.,Discover camera certain water science air. State responsibility least head apply value. Key similar quickly director range away. Keep send guy upon myself thought.,Cameras,EcoWear Apparel,"https://placekitten.com/640/480,https://www.lorempixel.com/640/480,https://www.lorempixel.com/640/480"
Fully-configurable demand-driven budgetary management,fully-configurable-demand-driven-budgetary-management,Report sign light become it back and various include all call deal break second prepare.,Chance join know on. Bill smile though fact Mrs organization several. Bad education ok capital audience cold specific. Assume others company current cut scene station your. Call direction right.,Baking & Mixing,Outdoor Gear Co.,https://placekitten.com/640/480
Networked human-resource open architecture,networked-human-resource-open-architecture,Present physical quality cell operation worker already measure involve southern close drive goal conference body.,Here just thing attorney live. Democratic if likely power short model person. Care pattern question either. City town save. Indicate sport final win generation police daughter.,Fashion,Health & Beauty Innovations,https://dummyimage.com/640x480
Multi-channeled object-oriented neural-net,multi-channeled-object-oriented-neural-net,Congress language on institution senior painting way issue make low relationship whose never power.,Table traditional second out court. Family apply himself despite product whole.,Baking & Mixing,EcoWear Apparel,"https://placekitten.com/640/480,https://dummyimage.com/640x480,https://placekitten.com/640/480"
Phased uniform archive,phased-uniform-archive,Example example pick million expect hair name.,Same ten learn walk. Medical him we compare raise environment. Direction community must example leader.,Smart Phone,Home Comforts Ltd.,https://dummyimage.com/640x480
Organized user-facing Graphic Interface,organized-user-facing-graphic-interface,Cell article eat response different resource issue change wrong beat.,Amount international open common new oil. Beat reveal project leader. Force kid fight mention. School culture significant five building ahead. Kitchen information miss for.,Cleaning,Home Comforts Ltd.,"https://www.lorempixel.com/640/480,https://placekitten.com/640/480,https://placekitten.com/640/480"
Front-line maximized challenge,front-line-maximized-challenge,Put raise center deep write similar character top choice behavior development.,Off term together stage phone degree but language. Watch seem trouble. Choose sit still effort.,Oral Care,Kitchen Masterpieces,https://www.lorempixel.com/640/480
Horizontal impactful Internet solution,horizontal-impactful-internet-solution,Hospital improve research continue seat for perhaps leave analysis fish tough deal major discussion once.,Strategy table them hospital program. Heart tree it in.,Sports & Outdoors,KidZone Essentials,"https://placeimg.com/640/480/any,https://placeimg.com/640/480/any,https://www.lorempixel.com/640/480"
Persistent uniform flexibility,persistent-uniform-flexibility,At chair those a everyone entire low with especially road have.,After meeting maybe former eye task. Talk hospital teacher look yeah soon.,Home & Living,Health & Beauty Innovations,"https://dummyimage.com/640x480,https://placekitten.com/640/480"
Cross-platform system-worthy matrices,cross-platform-system-worthy-matrices,Cold candidate husband turn measure top others statement short billion.,Right able cover two enough partner piece or. Those almost item reduce affect sing table. Determine detail either eat blue concern indeed.,Sports & Outdoors,Sports Gear Pro,https://placekitten.com/640/480
Enhanced encompassing neural-net,enhanced-encompassing-neural-net,Light word southern feeling race especially themselves.,Their court political toward. Explain coach especially push able. Mission me detail picture design value ground. Deal early voice hear.,Fitness Equipment,Book Nook Publishers,https://www.lorempixel.com/640/480
Open-architected secondary collaboration,open-architected-secondary-collaboration,Business defense phone unit end drop thought research though by such include it American address.,Yes real town left. Book ahead college full. Play hour interview ground. Court while spend score change happy. Next must yourself always beautiful usually.,Smart Home,Health & Beauty Innovations,https://placeimg.com/640/480/any
Distributed uniform core,distributed-uniform-core,Draw upon skin a community carry try debate kid all stay many feeling.,Ago set risk moment parent record catch. Simple police try as. Someone establish scientist during cold.,Health & Beauty,Kitchen Masterpieces,"https://www.lorempixel.com/640/480,https://placekitten.com/640/480"
Assimilated asynchronous forecast,assimilated-asynchronous-forecast,None already particular simply perhaps her international guy local ago data without development usually.,Relationship herself protect require reality. Class where air.,Smart Home,Bac Mobile,https://placeimg.com/640/480/any
Up-sized intangible protocol,up-sized-intangible-protocol,Discover form why well as theory window soldier.,Threat series total state here. Car sure story point grow. Even stuff thing success. Enjoy than state. Race class young real together.,Smart Phone,Bac Mobile,https://dummyimage.com/640x480
Grass-roots 24hour groupware,grass-roots-24hour-groupware,Enough around someone now really loss pay run.,Significant threat must social whole. Something growth free white explain. Customer its score soon behind series.,Cameras,Furniture & Decor Mart,"https://dummyimage.com/640x480,https://placekitten.com/640/480,https://dummyimage.com/640x480"
Optional reciprocal archive,optional-reciprocal-archive,Under season teach glass conference which ten wait character thank.,Black them successful wonder. Sell economy rule difference believe. Citizen every base body.,Cameras,Kitchen Masterpieces,"https://placekitten.com/640/480,https://www.lorempixel.com/640/480"
Upgradable directional toolset,upgradable-directional-toolset,Become usually myself item really box method respond hit edge window president education.,Work bad activity space media student second. Cost project far already among marriage. Environmental month sport.,Hoodies,Tech Innovations Inc.,"https://dummyimage.com/640x480,https://placeimg.com/640/480/any"
Robust context-sensitive functionalities,robust-context-sensitive-functionalities,Dinner food newspaper seven any before table.,Level beautiful someone behavior if. Firm need eight account third suddenly.,Health & Beauty,Outdoor Gear Co.,https://www.lorempixel.com/640/480
Enhanced executive ability,enhanced-executive-ability,Discussion somebody list also stock item term water mind hotel challenge.,To have baby. Watch avoid opportunity turn determine statement. Drop large site there determine example. Media adult test need.,Books & Media,Kitchen Masterpieces,https://placekitten.com/640/480
Triple-buffered zero administration conglomeration,triple-buffered-zero-administration-conglomeration,Safe exist your else life main consider federal above control international between.,Study hair option development television short. Street fast continue detail hard. See finally Mr pattern no.,Cookware,Sports Gear Pro,"https://placekitten.com/640/480,https://placeimg.com/640/480/any"
Triple-buffered dynamic complexity,triple-buffered-dynamic-complexity,Night international section send side his actually American within me college number first threat.,Special me from over. Result night recognize heavy rock choice. North dream lot her.,Oral Care,Furniture & Decor Mart,"https://dummyimage.com/640x480,https://placeimg.com/640/480/any,https://placeimg.com/640/480/any"
