title,slug,description,content,categoryNames,supplierName,images
Decentralized client-driven frame,decentralized-client-driven-frame,Least coach air move read there eight board until success field Mrs Mrs.,Create lay store. Economy budget security skill. Manager loss official. Later short box name.,Fiction,EcoWear Apparel,"https://placekitten.com/640/480,https://www.lorempixel.com/640/480"
Managed fresh-thinking approach,managed-fresh-thinking-approach,Tough decision fill reveal such situation we fast position enter local.,Rate research whole machine own inside. End its break price throughout.,Fashion,Outdoor Gear Co.,"https://www.lorempixel.com/640/480,https://placeimg.com/640/480/any"
Object-based web-enabled methodology,object-based-web-enabled-methodology,With official population open eye life wind leave challenge occur he defense standard image.,Yes majority whole however million. Authority imagine product water clearly. Officer so production fine. One need bill investment together apply should. Production reflect serious.,Oral Care,Book Nook Publishers,"https://placekitten.com/640/480,https://dummyimage.com/640x480"
Ergonomic incremental hierarchy,ergonomic-incremental-hierarchy,Catch wife development pick ball buy head total head care strong improve those sometimes.,Value option table bill outside. Eight sea would year. Social will sign clearly. Record who some different analysis before memory keep.,Bedding,KidZone Essentials,"https://placekitten.com/640/480,https://placeimg.com/640/480/any,https://www.lorempixel.com/640/480"
Open-source full-range installation,open-source-full-range-installation,Father adult one fund rest size stage artist learn culture raise base knowledge across box.,Behind account military bring. Soldier control stand body else truth. Once watch we pull expect free.,Cookware,Home Comforts Ltd.,"https://placeimg.com/640/480/any,https://www.lorempixel.com/640/480,https://placeimg.com/640/480/any"
Distributed tertiary hub,distributed-tertiary-hub,Public evidence pass page teach rich exist special discover take reach action news.,Degree doctor game thank. Store here employee what. Respond couple third nature administration since.,Fiction,Sports Gear Pro,https://placekitten.com/640/480
Triple-buffered dedicated encryption,triple-buffered-dedicated-encryption,Far break often around owner back true risk business key mean that.,Magazine executive half prepare instead. Friend responsibility thus learn bag per. Nice hotel several glass also. Red try mean physical she while.,Bedding,Health & Beauty Innovations,"https://placeimg.com/640/480/any,https://www.lorempixel.com/640/480"
Mandatory client-driven framework,mandatory-client-driven-framework,Difficult seek move institution rise Democrat buy stand current apply result artist.,Drive thousand share firm environmental event. Under without six blood no. Society condition suddenly across green road finally. Support party available benefit simple science.,Shelving,Bac Mobile,"https://www.lorempixel.com/640/480,https://www.lorempixel.com/640/480,https://www.lorempixel.com/640/480"
Synchronized stable portal,synchronized-stable-portal,Report doctor couple risk character case east stand several today fight past likely yes simply.,Really player without kind us order. Break own radio. Current school wide apply short low. Pattern protect son they. Rise on commercial college item education door.,Cleaning,Book Nook Publishers,"https://placeimg.com/640/480/any,https://placeimg.com/640/480/any"
Phased object-oriented toolset,phased-object-oriented-toolset,Paper hotel everybody must page down buy occur garden enter determine other social never like car.,Quite various thought chair dark lawyer choice. Lose probably third value successful hotel. Improve send change young real activity reveal. Listen avoid seek should that all. Manager production food wrong difference send.,Fitness & Exercise,Book Nook Publishers,"https://placeimg.com/640/480/any,https://placekitten.com/640/480"
Decentralized composite support,decentralized-composite-support,Should film call decision exactly business ahead can fine but budget truth.,Forget ready sit lawyer worker kitchen school. Hair water data effect friend act natural.,Bedding,EcoWear Apparel,"https://www.lorempixel.com/640/480,https://placekitten.com/640/480"
Distributed fault-tolerant time-frame,distributed-fault-tolerant-time-frame,Reality field direction act task bar reason camera agree trouble anyone two before down imagine us.,Into experience she network. Resource would less eye career key. Item return worker camera ten positive scene.,Kitchen Appliances,EcoWear Apparel,"https://dummyimage.com/640x480,https://www.lorempixel.com/640/480,https://dummyimage.com/640x480"
Public-key content-based paradigm,public-key-content-based-paradigm,Director thing follow also security north develop value go work tell.,Production traditional lead throughout entire. Speech firm heavy toward medical kind long certainly. Head religious building everything. Thing once he.,Furniture & Decor,Tech Innovations Inc.,https://placeimg.com/640/480/any
Cloned logistical Graphic Interface,cloned-logistical-graphic-interface,Television watch focus involve hit foreign nation hot usually poor cut card both how.,Group house foot religious only eye. Force those south major. Chance spring per call action.,Home & Living,Book Nook Publishers,"https://dummyimage.com/640x480,https://placeimg.com/640/480/any,https://placeimg.com/640/480/any"
Function-based needs-based standardization,function-based-needs-based-standardization,Family keep dinner anyone through as indeed center for agency leg although glass even city staff.,Bar group pay usually cup stand. White any decision quite feel. High dinner movie half. Happy agreement idea song effect local third. Beat country meet.,Electronics,Kitchen Masterpieces,"https://www.lorempixel.com/640/480,https://dummyimage.com/640x480"
Business-focused systemic encryption,business-focused-systemic-encryption,West task chair social local top daughter control.,Evidence responsibility stop people many. Often store so information town whose.,Fitness & Exercise,Bac Mobile,"https://placekitten.com/640/480,https://dummyimage.com/640x480,https://www.lorempixel.com/640/480"
Stand-alone secondary system engine,stand-alone-secondary-system-engine,Light drug open environmental goal ten exactly relationship forward force detail six life test seat.,Long history type carry west. Would hope series drive admit police. His economy challenge project recognize protect example resource. Growth culture suffer enough know natural church explain.,Cameras,Book Nook Publishers,"https://placekitten.com/640/480,https://dummyimage.com/640x480"
Ameliorated scalable info-mediaries,ameliorated-scalable-info-mediaries,Employee attorney film them I name image sometimes student let.,Attention two provide certainly heart. More against north hotel note. Point year baby. Board instead police tax government. Hair current three would reason suggest discussion center.,Camping Gear,Furniture & Decor Mart,https://dummyimage.com/640x480
Vision-oriented 4thgeneration contingency,vision-oriented-4thgeneration-contingency,Pick walk address billion any newspaper ten positive throughout.,Enter later reality test recent dream require voice. Use usually chair.,Kids & Toys,Bac Mobile,"https://dummyimage.com/640x480,https://dummyimage.com/640x480"
Automated methodical task-force,automated-methodical-task-force,Into difficult event fish anything shake however old.,Sell difficult company training from executive. Situation position page partner gun never pull. Consumer investment himself set. Inside true all today decide order.,Furniture & Decor,Sports Gear Pro,"https://www.lorempixel.com/640/480,https://placekitten.com/640/480"
Digitized real-time service-desk,digitized-real-time-service-desk,Apply system build past detail main door themselves agreement forget rate even note for.,Executive condition look sort current PM. Event federal treatment traditional event yeah. Such until sure edge somebody former mean. Have both article represent. Feeling task career impact team scene source.,Cookware,Home Comforts Ltd.,https://www.lorempixel.com/640/480
Cloned well-modulated secured line,cloned-well-modulated-secured-line,Young quite hour morning agency fish number company trouble thus no forward decision house forget author.,Realize improve reveal full above sort especially job. Enter family figure general message rest near. Talk operation writer offer candidate voice she. Suffer subject process first clear positive grow. Success case window name sing collection agency.,Health & Beauty,Furniture & Decor Mart,"https://placekitten.com/640/480,https://www.lorempixel.com/640/480,https://www.lorempixel.com/640/480"
Programmable dedicated knowledge user,programmable-dedicated-knowledge-user,Campaign whose major enjoy fall event most have option bring set while like food whole.,Cover modern present view finally. Condition admit whole simply several sing minute site. Toward represent rock happy exactly her. Local material identify.,Home & Living,Tech Innovations Inc.,https://placeimg.com/640/480/any
Mandatory modular core,mandatory-modular-core,Woman story smile rich place himself right garden key movie in home.,Name option apply score debate adult Democrat do. North soldier individual keep hold. Statement south have two.,Kids & Toys,Health & Beauty Innovations,"https://www.lorempixel.com/640/480,https://www.lorempixel.com/640/480,https://placekitten.com/640/480"
Re-engineered analyzing support,re-engineered-analyzing-support,Better win it will style law bed would pull.,Claim forward network crime back. Follow interesting indicate share research idea.,Sports & Outdoors,Furniture & Decor Mart,https://placeimg.com/640/480/any
Secured dedicated knowledgebase,secured-dedicated-knowledgebase,Serve audience include say law huge line feeling region actually safe growth here back bag degree.,Long mind own onto alone. Possible laugh show difficult throughout ago. Who main daughter make activity receive past then. Because score capital somebody science structure chance.,Hoodies,KidZone Essentials,https://www.lorempixel.com/640/480
Profound non-volatile leverage,profound-non-volatile-leverage,Lose once product spend within factor five upon stay somebody.,Myself guess administration meet discussion Republican. Single through church enter practice rather experience. Protect piece major surface.,Cameras,KidZone Essentials,"https://dummyimage.com/640x480,https://dummyimage.com/640x480,https://www.lorempixel.com/640/480"
Universal bandwidth-monitored synergy,universal-bandwidth-monitored-synergy,National force short along less newspaper street discuss lay scientist.,Often world operation fund could. Difficult very adult necessary crime.,Smart Home,EcoWear Apparel,https://placekitten.com/640/480
Devolved user-facing toolset,devolved-user-facing-toolset,Thousand be fast run might garden financial government push respond.,Yard store model number without. Item father sing event citizen know middle final. Their set will window amount agent.,Fashion,EcoWear Apparel,https://placeimg.com/640/480/any
